{
  "$schema": "http://json-schema.org/draft-07/schema#",
  "$id": "https://github.com/Skords-01/Sergeant/blob/main/docs/04-governance/governance/schemas/symbol-catalog.schema.json",
  "title": "Sergeant Symbol Catalog (per-package)",
  "description": "Per-workspace symbol export inventory. One file lives in each workspace directory as `symbols.json`; the aggregated `docs/04-governance/governance/symbol-index.json` indexes them. Generated by scripts/docs/generate-symbol-catalog.mjs.",
  "type": "object",
  "required": ["version", "generated_at", "package", "exports"],
  "additionalProperties": false,
  "properties": {
    "$schema": { "type": "string" },
    "version": { "type": "integer", "minimum": 1 },
    "generated_at": { "type": "string", "format": "date" },
    "package": {
      "type": "string",
      "description": "Canonical workspace name from package.json (e.g. `@sergeant/api-client`)."
    },
    "entryFile": {
      "type": ["string", "null"],
      "description": "Repo-relative path of the entry file parsed for exports; null if no entry could be resolved."
    },
    "stats": {
      "type": "object",
      "required": ["exportCount", "totalImporters", "deadExports"],
      "additionalProperties": false,
      "properties": {
        "exportCount": { "type": "integer", "minimum": 0 },
        "totalImporters": {
          "type": "integer",
          "minimum": 0,
          "description": "Unique files (across all workspaces) that import from this package."
        },
        "deadExports": {
          "type": "integer",
          "minimum": 0,
          "description": "Exports with `usageCount === 0`, excluding re-export-star and default."
        }
      }
    },
    "exports": {
      "type": "array",
      "items": { "$ref": "#/definitions/symbol" }
    }
  },
  "definitions": {
    "symbolKind": {
      "type": "string",
      "enum": [
        "function",
        "class",
        "enum",
        "interface",
        "type",
        "const",
        "default-export",
        "re-export",
        "re-export-star"
      ]
    },
    "symbol": {
      "type": "object",
      "required": ["name", "kind", "usedBy", "usageCount"],
      "additionalProperties": false,
      "properties": {
        "name": {
          "type": "string",
          "description": "Identifier as it appears in the entry file's export statement (or `*` for re-export-star)."
        },
        "kind": { "$ref": "#/definitions/symbolKind" },
        "fromFile": {
          "type": "string",
          "description": "Module specifier when the export originates from a re-export (`export { x } from './mod'`)."
        },
        "usageCount": { "type": "integer", "minimum": 0 },
        "usedBy": {
          "type": "array",
          "items": { "type": "string" },
          "description": "Sorted list of repo-relative file paths that import this symbol. Currently regex-derived — `import { x as y }` records `x`."
        }
      }
    }
  }
}
