{
  "$schema": "../../docs/04-governance/governance/schemas/symbol-catalog.schema.json",
  "version": 1,
  "generated_at": "2026-07-29",
  "package": "@sergeant/dualwrite-core",
  "entryFile": "packages/dualwrite-core/src/index.ts",
  "stats": {
    "exportCount": 1,
    "totalImporters": 26,
    "deadExports": 0
  },
  "exports": [
    {
      "name": "*",
      "kind": "re-export-star",
      "fromFile": "./apply.js",
      "usedBy": [],
      "usageCount": 0
    }
  ]
}
