{
  "$schema": "../../docs/governance/schemas/symbol-catalog.schema.json",
  "version": 1,
  "generated_at": "2026-05-15",
  "package": "@sergeant/openclaw",
  "entryFile": "tools/openclaw/src/index.ts",
  "stats": {
    "exportCount": 1,
    "totalImporters": 0,
    "deadExports": 1
  },
  "exports": [
    {
      "name": "HELP_TEXT",
      "kind": "re-export",
      "fromFile": "./help-text.js",
      "usedBy": [],
      "usageCount": 0
    }
  ]
}
