{
  "$schema": "../../docs/04-governance/governance/schemas/symbol-catalog.schema.json",
  "version": 1,
  "generated_at": "2026-07-29",
  "package": "@sergeant/server",
  "entryFile": "apps/server/src/index.ts",
  "stats": {
    "exportCount": 0,
    "totalImporters": 0,
    "deadExports": 0
  },
  "exports": []
}
